{"aggregate":{"endpoint_atlas":[{"endpoint_sha256":"e0c1c3550f8428db06c6ea9320c5727c547328eb5fb0c3abd67575af9e6f58ba","observation_count":10,"phase":"PARK","point_board_mm":{"frame":"board","x":304.9990031881125,"y":185.62569208141082,"z":118.51132151593943},"reuse_candidate_observed":true,"route_count":5,"route_ids":["alphabetic-extremes","home-transition","number-space-enter","repeat-number-punctuation","word-robot"],"solution_joint_state_sha256s":["e7ea2b2521eac34bb54bb6bcbb725faaf980cd5ade5b13934ef707a7bfac75b3"],"solution_variant_count":1,"stable_solution_observed":true,"target_id":null},{"endpoint_sha256":"94fbfd5dcc9366fc474ea27aef032f6f3a6ab1d22aa787d5fa6e7a6da22c0bed","observation_count":3,"phase":"HOVER","point_board_mm":{"frame":"board","x":304.9990031881125,"y":185.62569208141082,"z":118.51132151593943},"reuse_candidate_observed":true,"route_count":2,"route_ids":["home-transition","repeat-number-punctuation"],"solution_joint_state_sha256s":["e7ea2b2521eac34bb54bb6bcbb725faaf980cd5ade5b13934ef707a7bfac75b3"],"solution_variant_count":1,"stable_solution_observed":true,"target_id":"H"},{"endpoint_sha256":"2edb284823f6b4c96011a81b83f88891bc323beadde4f02525450937953b1181","observation_count":3,"phase":"CONTACT","point_board_mm":{"frame":"board","x":304.9990031881125,"y":185.62569208141082,"z":113.51132151593943},"reuse_candidate_observed":true,"route_count":2,"route_ids":["home-transition","repeat-number-punctuation"],"solution_joint_state_sha256s":["9c3814144ef34848f7ec25f078762b4b113229aa9dad8d3e397cfa6e004670a6"],"solution_variant_count":1,"stable_solution_observed":true,"target_id":"H"},{"endpoint_sha256":"9fa1fa795a871e4f7992680eed8d30d2dc346afe44277abb114c6d47ad1652cc","observation_count":3,"phase":"RETRACT","point_board_mm":{"frame":"board","x":304.9990031881125,"y":185.62569208141082,"z":118.51132151593943},"reuse_candidate_observed":true,"route_count":2,"route_ids":["home-transition","repeat-number-punctuation"],"solution_joint_state_sha256s":["e7ea2b2521eac34bb54bb6bcbb725faaf980cd5ade5b13934ef707a7bfac75b3"],"solution_variant_count":1,"stable_solution_observed":true,"target_id":"H"},{"endpoint_sha256":"806a4b259ebb9d6bba8bdceed5cebebbaa7b2373ed63504198bcd1f4a761a111","observation_count":1,"phase":"HOVER","point_board_mm":{"frame":"board","x":305.1990031881125,"y":185.62569208141082,"z":118.51132151593943},"reuse_candidate_observed":false,"route_count":1,"route_ids":["home-transition"],"solution_joint_state_sha256s":["7ad259716869025294e009a81ad0e678b52e2b6223598c588bd63aa47f755f0d"],"solution_variant_count":1,"stable_solution_observed":true,"target_id":"I"},{"endpoint_sha256":"50740d4c41ec63bc481eada219b25c8bc46d8519e74a542df426fd80a5574a30","observation_count":1,"phase":"CONTACT","point_board_mm":{"frame":"board","x":305.1990031881125,"y":185.62569208141082,"z":113.51132151593943},"reuse_candidate_observed":false,"route_count":1,"route_ids":["home-transition"],"solution_joint_state_sha256s":["95c0bec66a7473378950dc7a02e2892ddb1905085c1ec30e2edf3d2776f50736"],"solution_variant_count":1,"stable_solution_observed":true,"target_id":"I"},{"endpoint_sha256":"6f487258b98bd9c109f6bd90e143a8b9ff082c3d353688fa109b988342be8c0c","observation_count":1,"phase":"RETRACT","point_board_mm":{"frame":"board","x":305.1990031881125,"y":185.62569208141082,"z":118.51132151593943},"reuse_candidate_observed":false,"route_count":1,"route_ids":["home-transition"],"solution_joint_state_sha256s":["7ad259716869025294e009a81ad0e678b52e2b6223598c588bd63aa47f755f0d"],"solution_variant_count":1,"stable_solution_observed":true,"target_id":"I"},{"endpoint_sha256":"d6a1c1b965aacbcce7d5e1a2dcb27465da6dda122dd1a89c0dd6b6bfc82b6756","observation_count":1,"phase":"HOVER","point_board_mm":{"frame":"board","x":304.9990031881125,"y":185.62569208141082,"z":118.51132151593943},"reuse_candidate_observed":false,"route_count":1,"route_ids":["word-robot"],"solution_joint_state_sha256s":["e7ea2b2521eac34bb54bb6bcbb725faaf980cd5ade5b13934ef707a7bfac75b3"],"solution_variant_count":1,"stable_solution_observed":true,"target_id":"R"},{"endpoint_sha256":"98dab8bbefb66c6f751bc27bbf605ffef4e22b862d7d2ac21c802785cb4f6bb4","observation_count":1,"phase":"CONTACT","point_board_mm":{"frame":"board","x":304.9990031881125,"y":185.62569208141082,"z":113.51132151593943},"reuse_candidate_observed":false,"route_count":1,"route_ids":["word-robot"],"solution_joint_state_sha256s":["9c3814144ef34848f7ec25f078762b4b113229aa9dad8d3e397cfa6e004670a6"],"solution_variant_count":1,"stable_solution_observed":true,"target_id":"R"},{"endpoint_sha256":"af62c37f104cc9e97cde0eb641e0af4c69a18841cf28d1655ac740a947b8f935","observation_count":1,"phase":"RETRACT","point_board_mm":{"frame":"board","x":304.9990031881125,"y":185.62569208141082,"z":118.51132151593943},"reuse_candidate_observed":false,"route_count":1,"route_ids":["word-robot"],"solution_joint_state_sha256s":["e7ea2b2521eac34bb54bb6bcbb725faaf980cd5ade5b13934ef707a7bfac75b3"],"solution_variant_count":1,"stable_solution_observed":true,"target_id":"R"},{"endpoint_sha256":"e9fc1bfa658e1bad96edc1a6e9a03bebaf676e74956620c2990fd609e3725b23","observation_count":2,"phase":"HOVER","point_board_mm":{"frame":"board","x":305.1990031881125,"y":185.62569208141082,"z":118.51132151593943},"reuse_candidate_observed":true,"route_count":1,"route_ids":["word-robot"],"solution_joint_state_sha256s":["7ad259716869025294e009a81ad0e678b52e2b6223598c588bd63aa47f755f0d"],"solution_variant_count":1,"stable_solution_observed":true,"target_id":"O"},{"endpoint_sha256":"edb950480334b1fe247721cb89b5ed7650aa6c964daadc1b50749844297e6ce1","observation_count":2,"phase":"CONTACT","point_board_mm":{"frame":"board","x":305.1990031881125,"y":185.62569208141082,"z":113.51132151593943},"reuse_candidate_observed":true,"route_count":1,"route_ids":["word-robot"],"solution_joint_state_sha256s":["95c0bec66a7473378950dc7a02e2892ddb1905085c1ec30e2edf3d2776f50736"],"solution_variant_count":1,"stable_solution_observed":true,"target_id":"O"},{"endpoint_sha256":"6bdd65c5d785258776fb55f3d0d1ae67f114420f08406c6c5f2f1986a17e3b6b","observation_count":2,"phase":"RETRACT","point_board_mm":{"frame":"board","x":305.1990031881125,"y":185.62569208141082,"z":118.51132151593943},"reuse_candidate_observed":true,"route_count":1,"route_ids":["word-robot"],"solution_joint_state_sha256s":["7ad259716869025294e009a81ad0e678b52e2b6223598c588bd63aa47f755f0d"],"solution_variant_count":1,"stable_solution_observed":true,"target_id":"O"},{"endpoint_sha256":"0213ba170dbea0fcbeb1b5b2f2e9db089d3a87317df13129679040b595a9028a","observation_count":1,"phase":"HOVER","point_board_mm":{"frame":"board","x":305.3990031881125,"y":185.62569208141082,"z":118.51132151593943},"reuse_candidate_observed":false,"route_count":1,"route_ids":["word-robot"],"solution_joint_state_sha256s":["d8e98ade597894922d0d578a98e1b567ecf0d366bad01d62758047e61780c164"],"solution_variant_count":1,"stable_solution_observed":true,"target_id":"B"},{"endpoint_sha256":"e63c5eac0d2ae2536cd73e03b352a7ace0831b7e3df6e17a51234aaaa9a149c6","observation_count":1,"phase":"CONTACT","point_board_mm":{"frame":"board","x":305.3990031881125,"y":185.62569208141082,"z":113.51132151593943},"reuse_candidate_observed":false,"route_count":1,"route_ids":["word-robot"],"solution_joint_state_sha256s":["d2ddd0c6df78e0254fbb0758bb51fabaecd365a68306e9ad82f9e6365824a0f6"],"solution_variant_count":1,"stable_solution_observed":true,"target_id":"B"},{"endpoint_sha256":"5a31cadee177b9da66798fe74c271bbfd2a2f868bf985bd2d47b0db0fa1c5c4d","observation_count":1,"phase":"RETRACT","point_board_mm":{"frame":"board","x":305.3990031881125,"y":185.62569208141082,"z":118.51132151593943},"reuse_candidate_observed":false,"route_count":1,"route_ids":["word-robot"],"solution_joint_state_sha256s":["967d6dea9fbdce74fb1c51f90cb3ecc0edb0fd30c2b79786421237d984b63c9e"],"solution_variant_count":1,"stable_solution_observed":true,"target_id":"B"},{"endpoint_sha256":"5164ecac1ac17526c1bd34bac2bf5472e8643179ffbea4b2bf2263177969741c","observation_count":1,"phase":"HOVER","point_board_mm":{"frame":"board","x":305.59900318811253,"y":185.62569208141082,"z":118.51132151593943},"reuse_candidate_observed":false,"route_count":1,"route_ids":["word-robot"],"solution_joint_state_sha256s":["30b245eaa534ddee2a344cfb56830e3a6387fd5c586a8ca6e469d9fd9d1d9cfa"],"solution_variant_count":1,"stable_solution_observed":true,"target_id":"T"},{"endpoint_sha256":"8a1fadf264274f52a70951ffa22c32df3970799707a40e963e8c2d21288473bd","observation_count":1,"phase":"CONTACT","point_board_mm":{"frame":"board","x":305.59900318811253,"y":185.62569208141082,"z":113.51132151593943},"reuse_candidate_observed":false,"route_count":1,"route_ids":["word-robot"],"solution_joint_state_sha256s":["0c98532f86ac4ca305d5ee2326c627b4998e5c7317d2d66a25d6dfdee0ce8933"],"solution_variant_count":1,"stable_solution_observed":true,"target_id":"T"},{"endpoint_sha256":"3e212ae9f5a996eda3f7b62f94d71a07657051f199d17e67dd8c2b4ca5f532e0","observation_count":1,"phase":"RETRACT","point_board_mm":{"frame":"board","x":305.59900318811253,"y":185.62569208141082,"z":118.51132151593943},"reuse_candidate_observed":false,"route_count":1,"route_ids":["word-robot"],"solution_joint_state_sha256s":["2c2d1c79bb42aae3950e02f051f5a90c4c341605b6899d5819ec230d2af9da3d"],"solution_variant_count":1,"stable_solution_observed":true,"target_id":"T"},{"endpoint_sha256":"99ae2228a0df2f516a14aaad82201cb61917da8188ac0ed5dcdfa120ebad510c","observation_count":1,"phase":"HOVER","point_board_mm":{"frame":"board","x":305.1990031881125,"y":185.62569208141082,"z":118.51132151593943},"reuse_candidate_observed":false,"route_count":1,"route_ids":["repeat-number-punctuation"],"solution_joint_state_sha256s":["7ad259716869025294e009a81ad0e678b52e2b6223598c588bd63aa47f755f0d"],"solution_variant_count":1,"stable_solution_observed":true,"target_id":"1"},{"endpoint_sha256":"ef02a63585a591897d714ee33022f69363f968eafaa86be4a23bc10ad31cc3f2","observation_count":1,"phase":"CONTACT","point_board_mm":{"fram